{
  "id": "class:example",
  "simple_name": "example",
  "name": "example name",
  "hit_die": "d8",
  "primary_abilities": [
    "strength"
  ],
  "saving_throw_proficiencies": [
    "strength",
    "strength"
  ],
  "proficiencies": {
    "armor": [
      "example armor"
    ],
    "weapons": [
      "example weapons"
    ],
    "tools": [
      "example tools"
    ]
  },
  "features": [
    "example features"
  ],
  "progression": [
    {
      "level": 1
    }
  ],
  "source": "example source",
  "page": 1
}
